title,description,source,publishedAt,url
Jim Cramer says concerns about AI market froth are overblown. Here's why,CNBC's Jim Cramer said today's stock market is far less concerning than it was during the dot-com bubble.,CNBC,2026-07-14T22:20:46Z,https://www.cnbc.com/2026/07/14/jim-cramer-concerns-ai-market-froth-overblown.html
vision-agents-plugins-nvidia 0.6.7,NVIDIA VLM plugin for Vision Agents,Pypi.org,2026-07-14T22:04:40Z,https://pypi.org/project/vision-agents-plugins-nvidia/0.6.7/
Quote of the day by Linux creator Linus Torvalds: 'Nvidia has been the single worst company we've ever dealt with' — airing frustrations at walled gardens,The Linux creator had a particularly tough time with Nvidia throughout history – but things have changed dramatically since then.,TechRadar,2026-07-14T22:00:00Z,https://www.techradar.com/pro/quote-of-the-day-by-linux-creator-linus-torvalds-nvidia-has-been-the-single-worst-company-weve-ever-dealt-with-airing-frustrations-at-walled-gardens
"Dow Jones, Nasdaq, US Stock Market Today Updates: Check Latest Move in Futures, Dow, S&P and Nasdaq Leads as AI Chip Stocks Jump, Crude Oil Surge, Bitcoin & Lucid Crash | Why Are Stocks Up Today","Dow Jones, Nasdaq, US Stock Market Today Updates: Check Latest Move in Futures, Dow, S&P and Nasdaq Leads as AI Chip Stocks Jump, Crude Oil Surge, Bitcoin & Lucid Crash | Why Are Stocks Up Todaysundayguardianlive.com",The Sunday Guardian,2026-07-14T21:33:18Z,https://sundayguardianlive.com/business/dow-jones-nasdaq-us-stock-market-today-updates-check-latest-move-in-futures-dow-sp-and-nasdaq-leads-as-ai-chip-stocks-jump-crude-oil-surge-bitcoin-lucid-crash-why-are-stocks-up-today-236814/
penguin-burner 0.7.4,"NVIDIA GPU tuning tool for Linux: automatic and adaptive undervolting, an in-game monitoring overlay with PC latency and pre-frame-generation FPS, plus MSI Afterburner imports and LACT exports",Pypi.org,2026-07-14T21:18:05Z,https://pypi.org/project/penguin-burner/0.7.4/
LabubaRAT malware masquerades as NVIDIA software to target Windows systems,A newly discovered Rust-based remote access trojan named LabubaRAT is targeting Windows environments by impersonating legitimate NVIDIA system components. The malware uses the filename nvidia-sysruntime.exe and includes NVIDIA-themed metadata to evade detecti…,4sysops.com,2026-07-14T21:08:47Z,https://4sysops.com/archives/labubarat-malware-masquerades-as-nvidia-software-to-target-windows-systems/
nvidia-nvcomp-cu13 5.3.0.16,NVIDIA nvcomp for CUDA 13,Pypi.org,2026-07-14T21:08:47Z,https://pypi.org/project/nvidia-nvcomp-cu13/5.3.0.16/
nvidia-nvcomp-cu12 5.3.0.16,NVIDIA nvcomp for CUDA 12,Pypi.org,2026-07-14T21:06:14Z,https://pypi.org/project/nvidia-nvcomp-cu12/5.3.0.16/
nvidia-libnvcomp-cu13 5.3.0.16,NVIDIA nvcomp for CUDA 13,Pypi.org,2026-07-14T21:05:57Z,https://pypi.org/project/nvidia-libnvcomp-cu13/5.3.0.16/
"Samsung SSD 990 Review: An M.2 With Mojo, But Perplexing Pricing","Seeing a brand-new internal SSD from Samsung—the SSD 990—is reassuring at a time when major manufacturers have slowed launches to a trickle amid the ongoing memory shortage. The SSD 990 (starts at $269.99 for 1TB; $529.99 for 2TB as tested) is a DRAM-less, en…",PCMag.com,2026-07-14T21:02:51Z,https://uk.pcmag.com/ssds/166158/samsung-ssd-990-review-an-m2-with-mojo-but-perplexing-pricing
